{
  "apps": [
    {
      "categories": [
        "Other"
      ],
      "compatibility": [
        "mobile",
        "switch",
        "web"
      ],
      "description": "<p>Turbo Arena 4.0 — Nintendo Switch / Brewser Edition</p>\r\n<p>&nbsp;</p>\r\n<p>Turbo Arena 4.0 is a 3D arcade driving game built with HTML5 and WebGL. This version is designed for widescreen gameplay and supports touchscreen input and Nintendo Switch game controllers.</p>\r\n<p>&nbsp;</p>\r\n<p>Controls</p>\r\n<p>&nbsp;</p>\r\n<p>- Left stick: Drive and steer</p>\r\n<p>- Right stick: Camera</p>\r\n<p>- A: Jump</p>\r\n<p>- B: Brake</p>\r\n<p>- Y: Drift</p>\r\n<p>- R: Nitro</p>\r\n<p>&nbsp;</p>\r\n<p>Features: Fullscreen gameplay, responsive menus, adjustable touch controls, and controller support.</p>\r\n<p>&nbsp;</p>\r\n<p>Compatibility: Designed for Brewser Runtime. Performance and input compatibility require testing on the target device.</p>\r\n<p>&nbsp;</p>\r\n<p>Credits: Original Turbo Arena 4.0 project. Third-party libraries and assets remain subject to their respective licenses.</p>\r\n<p>&nbsp;</p>\r\n<p>Disclaimer: This is an independent community project and is not affiliated with or endorsed by Nintendo.</p>",
      "developer": "Kübra Karagöz",
      "entry": "index.html",
      "features": [
        "Gamepad"
      ],
      "id": "com.civcivyt.turboarena",
      "license": "Apache-2.0",
      "logo": "assets/appbanner.jpg",
      "minBrewserVersion": "0.1.131",
      "name": "Turbo arena",
      "permissions": [],
      "publishedAt": "2026-10-24T10:04:02Z",
      "sizeBytes": 5702368,
      "summary": "Rocket league ye benzeyen bir oyun kontrolcü dokunmatik ve klavye ile oynanabiliyor",
      "version": "1.0.3"
    },
    {
      "categories": [
        "Demos",
        "Games"
      ],
      "compatibility": [
        "switch"
      ],
      "description": "<p><strong>2D Platformer Microgame</strong> is Unity's official learning template - a complete little side-scroller - compiled to WebGL and running natively on the Switch GPU, entirely offline.</p>\r\n<p><strong>How it works.</strong> This is a real Unity engine build (Unity 2021.3 LTS, Universal Render Pipeline) exported to WebAssembly. The whole game - physics, tilemap, animation, the Cinemachine follow-camera and TextMeshPro UI - runs inside the Brewser runtime through its <em>WebGL bridge</em>, which forwards the engine's draw calls to the console's graphics chip. The compressed build was unpacked so it loads from local storage with no web server.</p>\r\n<p><strong>How you play:</strong></p>\r\n<ul>\r\n<li><strong>Move</strong> - left stick or D-pad to run left and right.</li>\r\n<li><strong>Jump</strong> - the jump button to hop between platforms.</li>\r\n<li><strong>Collect &amp; avoid</strong> - grab pickups and dodge hazards through the level.</li>\r\n</ul>\r\n<p>A full Unity game engine, rendered live on Switch. Built from Unity's free 2D Platformer Microgame template.</p>",
      "developer": "Alex Daskalakis",
      "entry": "index.html",
      "features": [
        "Gamepad",
        "Media Devices"
      ],
      "genre": [
        "Platformer"
      ],
      "id": "com.natureglass.2dplatformermicrogame",
      "license": "MIT",
      "logo": "assets/appbanner.jpg",
      "name": "2D Platformer Microgame",
      "permissions": [
        "storage"
      ],
      "publishedAt": "2026-08-08T11:36:13Z",
      "sizeBytes": 30141034,
      "summary": "Unity's official 2D Platformer learning template, compiled to WebGL and running on the Switch GPU of",
      "version": "1.0.3"
    },
    {
      "categories": [
        "Apps",
        "Demos"
      ],
      "compatibility": [
        "switch",
        "web"
      ],
      "description": "<p><strong>AETHER</strong> turns a written phrase into a fullscreen animated field. Describe a world, watch it assemble, then open the console and take it apart.</p>\r\n<p><strong>How it works</strong></p>\r\n<p>Type something like <em>stormy alien ocean at dusk</em> and press Render. AETHER reads the phrase against a vocabulary of 168 words covering subjects, moods, colours, materials, styles and times of day. Every word it recognises contributes to a set of 40 numbers - field scale, warp depth, symmetry, palette, motion, atmosphere and finish - which are weighted and averaged into a single parameter set.</p>\r\n<p>That set drives a WebGL2 fragment shader that renders the whole scene in one pass, at 60fps, with no textures and no geometry. Nothing is pre-rendered: every pixel is computed from the parameters each frame.</p>\r\n<p>The <strong>Director read</strong> panel shows which words landed and which were ignored, so you can see exactly how your phrase was interpreted rather than guessing.</p>\r\n<p>The morph</p>\r\n<p>A new phrase doesn't cut to the result. The image and the console sliders travel to their new values together over about a second, so you can watch which parameters your words actually moved.</p>\r\n<p>Seven field types</p>\r\n<ul>\r\n<li><strong>Smooth</strong> - marbled, cloud-like domain warping</li>\r\n<li><strong>Bands</strong> - topographic contour lines</li>\r\n<li><strong>Rings</strong> - concentric ripples</li>\r\n<li><strong>Veins</strong> - wood and marble grain</li>\r\n<li><strong>Terrace</strong> - stepped plateaus</li>\r\n<li><strong>Streaks</strong> - directional strata</li>\r\n<li><strong>Cells</strong> - cracked, crystalline Worley noise</li>\r\n</ul>\r\n<p>Combined with 14 palettes and optional kaleidoscopic folding, the same phrase vocabulary reaches a wide range of looks rather than recolouring one texture.</p>\r\n<p>Controls</p>\r\n<ul>\r\n<li><strong>Render</strong> - interpret whatever is in the prompt box</li>\r\n<li><strong>New prompt</strong> - deal from a bank of 50 written phrases <em>(P)</em></li>\r\n<li><strong>Surprise me</strong> - ignore language, roll the parameters directly <em>(space)</em></li>\r\n<li><strong>Console</strong> - slide out the full 40-parameter panel <em>(H)</em></li>\r\n<li><strong>Save frame</strong> - export the current image as a PNG <em>(S)</em></li>\r\n<li><strong>Copy / Load JSON</strong> - move parameter sets in and out by hand</li>\r\n</ul>\r\n<p>Render scale is adjustable if you want to trade sharpness for framerate on slower hardware. Gamepad and keyboard are both supported, and the console hides completely for fullscreen viewing.</p>",
      "developer": "@natureglass",
      "entry": "index.html",
      "featured": true,
      "features": [
        "Gamepad"
      ],
      "id": "com.natureglass.aether",
      "license": "MIT",
      "logo": "assets/appbanner.jpg",
      "name": "Aether",
      "permissions": [
        "storage"
      ],
      "publishedAt": "2026-08-06T10:27:22Z",
      "sizeBytes": 3042467,
      "summary": "Type a phrase, watch a world assemble. Fullscreen procedural WebGL2 art that runs offline.",
      "tags": [
        "WebGL2",
        "Kaleidoscope"
      ],
      "version": "1.0.2"
    },
    {
      "categories": [
        "Apps"
      ],
      "compatibility": [
        "mobile",
        "switch",
        "web"
      ],